Rank,Title,Genre,Author,Synopsis,Volume,Rating,Status
1,Berserk,"Action, Adventure, Demons, Drama, Fantasy, Horror, Supernatural, Military, Psychological, Seinen",Arakawa Hiromu,"Guts, a former mercenary now known as the ""Black Swordsman,"" is out for revenge. After a tumultuous childhood, he finally finds someone he respects and believes he can trust, only to have everything fall apart when this person takes away everything important to Guts for the purpose of fulfilling his own desires. Now marked for death, Guts becomes condemned to a fate in which he is relentlessly pursued by demonic beings.

Setting out on a dreadful quest riddled with misfortune, Guts, armed with a massive sword and monstrous strength, will let nothing stop him, not even death itself, until he is finally able to take the head of the one who stripped him?and his loved one?of their humanity.",40,9.38,Publishing
2,One Piece,"Action, Adventure, Comedy, Fantasy, Shounen, Super Power",Oda Eiichiro,"Gol D. Roger, a man referred to as the ""Pirate King,"" is set to be executed by the World Government. But just before his demise, he confirms the existence of a great treasure, One Piece, located somewhere within the vast ocean known as the Grand Line. Announcing that One Piece can be claimed by anyone worthy enough to reach it, the Pirate King is executed and the Great Age of Pirates begins.

Twenty-two years later, a young man by the name of Monkey D. Luffy is ready to embark on his own adventure, searching for One Piece and striving to become the new Pirate King. Armed with just a straw hat, a small boat, and an elastic body, he sets out on a fantastic journey to gather his own crew and a worthy ship that will take them across the Grand Line to claim the greatest status on the high seas.",99,9.15,Publishing
3,Fullmetal Alchemist,"Action, Adventure, Comedy, Drama, Shounen, Military",Arakawa Hiromu,"Alchemists are knowledgeable and naturally talented individuals who can manipulate and modify matter due to their art. Yet despite the wide range of possibilities, alchemy is not as all-powerful as most would believe. Human transmutation is strictly forbidden, and whoever attempts it risks severe consequences. Even so, siblings Edward and Alphonse Elric decide to ignore this great taboo and bring their mother back to life. Unfortunately, not only do they fail in resurrecting her, they also pay an extremely high price for their arrogance: Edward loses his left leg and Alphonse his entire body. Furthermore, Edward also gives up his right arm in order to seal his brother's soul into a suit of armor.

Years later, the young alchemists travel across the country looking for the Philosopher's Stone, in the hopes of recovering their old bodies with its power. However, their quest for the fated stone also leads them to unravel far darker secrets than they could ever imagine.",27,9.08,Finished
4,Grand Blue,"Comedy, Slice of Life, Seinen","Inoue Kenji, Yoshioka, Kimitake","Among the seaside town of Izu's ocean waves and rays of shining sun, Iori Kitahara is just beginning his freshman year at Izu University. As he moves into his uncle's scuba diving shop, Grand Blue, he eagerly anticipates his dream college life, filled with beautiful girls and good friends.

But things don't exactly go according to plan. Upon entering the shop, he encounters a group of rowdy, naked upperclassmen, who immediately coerce him into participating in their alcoholic activities. Though unwilling at first, Iori quickly gives in and becomes the heart and soul of the party. Unfortunately, this earns him the scorn of his cousin, Chisa Kotegawa, who walks in at precisely the wrong time. Undeterred, Iori still vows to realize his ideal college life, but will things go according to plan this time, or will his situation take yet another dive?",66,9.04,Publishing
5,Slam Dunk,"Comedy, Drama, School, Shounen, Sports",Inoue Takehiko,"Hanamichi Sakuragi, a tall, boisterous teenager with flame-red hair and physical strength beyond his years, is eager to put an end to his rejection streak of 50 and finally score a girlfriend as he begins his first year of Shohoku High. However, his reputation for delinquency and destructiveness precedes him, and most of his fellow students subsequently avoid him like the plague. As his first day of school ends, he is left with two strong thoughts: ""I hate basketball"" and ""I need a girlfriend.""

Haruko Akagi, ignorant of Hanamichi's history of misbehavior, notices his immense height and unwittingly approaches him, asking whether or not he likes basketball. Overcome by the fact that a girl is speaking to him, the red-haired giant blurts out a yes despite his true feelings. At the gym, Haruko asks if he can do a slam dunk. Though a complete novice, Hanamachi palms the ball and makes the leap...but overshoots, slamming his head into the backboard. Amazed by his near-inhuman physical abilities, Haruko quickly notifies the school's basketball captain of his feat. With this, Hanamichi is unexpectedly thrust into a world of competition for a girl he barely knows, but he soon discovers that there is perhaps more to basketball than he once thought.",31,9.02,Finished
6,Vinland Saga,"Action, Adventure, Drama, Historical, Seinen",Yukimura Makoto,"Thorfinn, son of one of the Vikings' greatest warriors, is among the finest fighters in the merry band of mercenaries run by the cunning Askeladd, an impressive feat for a person his age. However, Thorfinn is not part of the group for the plunder it entails?instead, for having caused his family great tragedy, the boy has vowed to kill Askeladd in a fair duel. Not yet skilled enough to defeat him, but unable to abandon his vengeance, Thorfinn spends his boyhood with the mercenary crew, honing his skills on the battlefield among the war-loving Danes, where killing is just another pleasure of life.

One day, when Askeladd receives word that Danish prince Canute has been taken hostage, he hatches an ambitious plot?one that will decide the next King of England and drastically alter the lives of Thorfinn, Canute, and himself. Set in 11th century Europe, Vinland Saga tells a bloody epic in an era where violence, madness, and injustice are inescapable, providing a paradise for the battle-crazed and utter hell for the rest who live in it.",24,8.94,Publishing
7,Haikyuu!!,"Comedy, Drama, School, Shounen, Sports",Furudate Haruichi ,"The whistle blows. The ball is up. A dig. A set. A spike.

Volleyball. A sport where two teams face off, separated by a formidable, wall-like net.

The ""Little Giant,"" standing at only 170 cm, overcomes the towering net and the wall of blockers. The awe-inspired Shouyou Hinata looks on at the ace's crow-like figure. Determined to reach great heights like the Little Giant, small-statured Hinata finally manages to form a team in his last year of junior high school, and enters his first volleyball tournament. However, his team is utterly defeated in their first game against the powerhouse school Kitagawa Daiichi, led by the genius, but oppressive setter dubbed the ""King of the Court,"" Tobio Kageyama.

Hinata enrolls into Karasuno High School seeking to take revenge against Kageyama in an official high school match and to follow in the Little Giant's footsteps?but his plans are ruined when he opens the gymnasium door to find Kageyama as one of his teammates.

Now, Hinata must establish himself on the team and work alongside the problematic Kageyama to overcome his shortcomings and to fulfill his dream of making it to the top of the high school volleyball world.",45,8.9,Finished
8,GTO,"Action, Comedy, Drama, School, Shounen",Fujisawa Tohru,"Great Teacher Onizuka follows the incredible, though often ridiculous, antics of the titular teacher as he attempts to outwit and win over the cunning Class 3-4 that is determined to have him removed from the school. However, other obstacles present themselves throughout?including the frustrated, balding vice principal, Hiroshi Uchiyamada; old enemies from his biker days; and his own idiotic teaching methods. But Eikichi fights it all whilst trying to help his students, romance fellow teacher Azusa Fuyutsuki, and earn his self-proclaimed title.",25,8.89,Finished
9,3-gatsu no Lion,"Drama, Game, Slice of Life, Seinen",Umino Chika,"Rei Kiriyama is an extraordinary shogi player. Among the few elites to have gone professional as a middle school student, he is considered a genius. But what lies behind his prodigious facade is a teenage boy who suffers immense pressure from both his family, and from the high expectations from the shogi community. Rei moves out to live a more independent life away from his family, but his unorganized lifestyle and unsociable personality show no signs of improvement.

However, in a twist of fate that will prove to be a turning point in his life, Rei then encounters the Kawamoto sisters?the motherly Akari, the passionate Hinata, and the energetic Momo?who take great care of him. 3-gatsu no Lion tells the story of Rei as he reshapes his melancholic life and picks up the courage to begin facing the problems he evaded during his past.",15,8.89,Publishing
10,Koe no Katachi,"Drama, School, Shounen",Ooima Yoshitoki,"Shouya Ishida, a boy always looking for ways to beat boredom, ends up looking for it in the wrong place. Weirded out by his new classmate, a deaf transfer student named Shouko Nishimiya, he deems her as the target of his ostracizing and bullying. Day after day, Shouya picks on Shouko, unaware of the effects of his thoughtless actions. He finally understands the pain he has inflicted on her when one day, his bullying culminates in her leaving the school, and his classmates begin to shun and harass him every chance they get instead. Determined to right his wrongs, five years later, Shouya, now a third year high school loner, meets Shouko again. Thus begins the story of a young man's path to redemption.",7,8.86,Finished
11,Made in Abyss,"Adventure, Drama, Fantasy, Sci-Fi",Tsukushi Akihito ,"The Abyss, a hole of unprecedented depth?one young girl and a robot brave its dangers to find the truth.

The town of Orth is a special one, as it is built around the edges of the massive Abyss, a wonder which has never been fully explored. Those who venture too far down never return, but those brave enough to traverse its territories are known as ""Cave Raiders"" and are heralded as legends. Within this town lives a young girl called Riko, the child of one of the most famous Cave Raiders of all time who disappeared on an expedition many years ago.

One day, Riko's life changes when she meets a strange robot called Regu, who seems to appear from within the Abyss. Believing this to be a sign from her mother stuck at the bottom of the Abyss, Riko descends into its depths with Regu, ready to confront all the dangers within it.",10,8.83,Publishing
12,Mushishi,"Mystery, Fantasy, Historical, Supernatural, Seinen",Urushibara Yuki ,"""Mushi"": the most basic forms of life in the world. They exist without any goals or purposes aside from simply ""being."" They are beyond the shackles of the words ""good"" and ""evil."" Mushi can exist in countless forms and are capable of mimicking things from the natural world such as plants, diseases, and even phenomena like rainbows.

This is, however, just a vague definition of these entities that inhabit the vibrant world of Mushishi, as to even call them a form of life would be an oversimplification. Detailed information on mushi is scarce because the majority of humans are unaware of their existence.

So what are mushi and why do they exist? This is the question that a ""Mushishi,"" Ginko, ponders constantly. Mushishi are those who research mushi in hopes of understanding their place in the world's hierarchy of life.

Ginko relentlessly chases rumors of occurrences that could be tied to mushi, all for the sake of finding an answer.

It could, after all, lead to the meaning of life itself.",10,8.76,Finished
13,One Punch-Man,"Action, Comedy, Parody, Sci-Fi, Super Power, Supernatural"," Murata Yusuke , ONE ","After rigorously training for three years, the ordinary Saitama has gained immense strength which allows him to take out anyone and anything with just one punch. He decides to put his new skill to good use by becoming a hero. However, he quickly becomes bored with easily defeating monsters, and wants someone to give him a challenge to bring back the spark of being a hero.

Upon bearing witness to Saitama's amazing power, Genos, a cyborg, is determined to become Saitama's apprentice. During this time, Saitama realizes he is neither getting the recognition that he deserves nor known by the people due to him not being a part of the Hero Association. Wanting to boost his reputation, Saitama decides to have Genos register with him, in exchange for taking him in as a pupil. Together, the two begin working their way up toward becoming true heroes, hoping to find strong enemies and earn respect in the process.",23,8.73,Publishing
14,Death Note,"Mystery, Drama, Shounen, Supernatural, Psychological","Obata Takeshi, Ohba Tsugumi","Ryuk, a god of death, drops his Death Note into the human world for personal pleasure. In Japan, prodigious high school student Light Yagami stumbles upon it. Inside the notebook, he finds a chilling message: those whose names are written in it shall die. Its nonsensical nature amuses Light; but when he tests its power by writing the name of a criminal in it, they suddenly meet their demise.

Realizing the Death Note's vast potential, Light commences a series of nefarious murders under the pseudonym ""Kira,"" vowing to cleanse the world of corrupt individuals and create a perfect society where crime ceases to exist. However, the police quickly catch on, and they enlist the help of L?a mastermind detective?to uncover the culprit.

Death Note tells the thrilling tale of Light and L as they clash in a great battle-of-minds, one that will determine the future of the world.",12,8.72,Finished
15,Akira,"Action, Sci-Fi, Seinen",otomo Katsuhiro,"1988: It is World War III. Tokyo is decimated by a mysterious black explosion, unmatched in magnitude.

2019: Fast forward 31 years. Neo-Tokyo, hastily built on the ruins of old Tokyo, is a sprawling cityscape of neon extravaganza. It is a fusion of towering skyscrapers and cutting-edge technology that is permeated through and through with an explosive, hyper-violent cocktail of biker gangs, poverty, and revolutionaries. In this derelict metropolis live Tetsuo Shima and Shoutarou Kaneda, two bikers who are the best of friends and the fiercest of rivals, despite being affiliated with the same gang. Desperate to prove himself as Kaneda's equal, Tetsuo unwittingly pulls a stunt that culminates in the awakening of a cryptic existence that threatens to change both the face of Neo-Tokyo and the lives of those who call the city their home?the awakening of a government secret simply known as Akira.",6,8.71,Finished
16,Tokyo Revengers,"Action, School, Shounen","Wakui, Ken","Takemichi Hanagaki's life is at an all-time low. Just when he thought it couldn't get worse, he finds out that Hinata Tachibana, his ex-girlfriend, was murdered by the Tokyo Manji Gang: a group of vicious criminals that has been disturbing society's peace for quite some time.

Wondering where it all went wrong, Takemichi suddenly finds himself travelling through time, ending up 12 years in the past?when he was still in a relationship with Hinata. Realizing he has a chance to save her, Takemichi resolves to infiltrate the Tokyo Manji Gang and climb the ranks in order to rewrite the future and save Hinata from her tragic fate.",23,8.7,Publishing
17,Shoujo Shuumatsu Ryokou,"Adventure, Slice of Life",Tsukumizu ,"Amidst a post-apocalyptic world, Chito and Yuuri seem to be the final survivors of the war that brought civilization to its demise. No longer having a place to live, the girls roam around the city on their half-track motorcycle, ever in search of resources to sustain their vagabond lifestyle. Despite the bleak future ahead of them, the duo still finds ways to entertain themselves throughout this melancholic journey.

Shoujo Shuumatsu Ryokou takes place in a barren world during the harsh winter season. As the happy-go-lucky Yuuri and the serious Chito hopelessly search for a sign of civilization, their expedition may in fact become humanity's last tour.",6,8.69,Finished
18,Hunter x Hunter,"Action, Adventure, Fantasy, Shounen, Super Power","Togashi, Yoshihiro","""Secret treasure hoards, undiscovered wealth... mystical places, unexplored frontiers... 'The mysterious unknown.' There's magic in such words for those captivated by its spell. They are called 'Hunters'!""

Gon Freecss wants to become a Hunter so he can find his father, a man who abandoned him to pursue a life of adventure. But it's not that simple: only one in one hundred thousand can pass the Hunter Exam, and that is just the first obstacle on his journey. During the Hunter Exam, Gon befriends many other potential Hunters, such as the mysterious Killua; the revenge-driven Kurapika; and Leorio, who aims to become a doctor. There's a world of adventure and peril awaiting, and those who embrace it with open arms can become the greatest Hunters of them all!",36,8.68,Publishing
19,Beck,"Comedy, Drama, Music, Romance, Shounen, Slice of Life",Sakuishi Harold,"Yukio ""Koyuki"" Tanaka wasted away his middle school days listening to Japanese pop music and apathetically trudging through life?until a casual run-in with the enigmatic guitarist Ryuusuke ""Ray"" Minami. Through this encounter, Koyuki realizes what he has been missing all this time as Ray introduces him to western rock music and jumpstarts his desire to play guitar.

Although various struggles plague his path to rock fame, Koyuki refuses to abandon the passion that gave his life purpose, balancing it together with school, work, and friends. Beck tells the story of the love and trial that accompanies pursuing a professional career in music as Koyuki and Ray work toward realizing the guitarist's dream of the ultimate band.",34,8.68,Finished
20,ReLIFE,"Comedy, Drama, Romance, School, Slice of Life","Yayoi, Sou","When the responsibilities of being an adult and the ugly side of corporate bullying betrays one's childhood dreams, many would wish to return to their innocent childhood to relive their life and make the right decisions. Dumbfounded by the offer presented to him, 27-year-old Arata Kaizaki hopes to turn his life around through a once-in-a-lifetime opportunity.

Returning home from his part-time job, Arata is persuaded by Ryou Yoake, an employee of ReLife Research Institute, into participating in an experiment which will help him overcome his difficulties and re-enter corporate life. As part of the ReLife experiment, Arata's physique is reverted to that of a 17-year-old, and all he must do is relive his high school life for one year. Waiting for him at the end of the experiment is a job offer that he has been struggling to get ever since he left his first company.

With few other options, he decides to go along with this plan. However, with adult-like tendencies and many years since his last formal education, Arata steps into an unexpectedly challenging territory?a normal day of high school.",15,8.67,Finished
21,Blue Period,"Drama, School, Seinen",Yamaguchi Tsubasa ,"Second-year high school student Yatora Yaguchi is bored with his normal life. He studies well and plays around with his friends, but in truth, he does not enjoy either of those activities. Bound by norms, he secretly envies those who do things differently.

That is until he discovers the joy of drawing. When he sees a painting made by a member of the Art Club, Yatora becomes fascinated with the colors used in it. Later, in an art exercise, he tries to convey his language without words but instead through painting. After that experience, Yatora finds himself so invested in art that he decides that it is what he wants to do for a living. But there stand multiple obstacles in his way: his parents who are hesitant over his unique choices, his more experienced peers, and the study of a subject much deeper than he initially expected.",10,8.66,Publishing
22,Chainsaw Man,"Action, Adventure, Demons, Shounen",Fujimoto Tatsuki,"Denji has a simple dream?to live a happy and peaceful life, spending time with a girl he likes. This is a far cry from reality, however, as Denji is forced by the yakuza into killing devils in order to pay off his crushing debts. Using his pet devil Pochita as a weapon, he is ready to do anything for a bit of cash.

Unfortunately, he has outlived his usefulness and is murdered by a devil in contract with the yakuza. However, in an unexpected turn of events, Pochita merges with Denji's dead body and grants him the powers of a chainsaw devil. Now able to transform parts of his body into chainsaws, a revived Denji uses his new abilities to quickly and brutally dispatch his enemies. Catching the eye of the official devil hunters who arrive at the scene, he is offered work at the Public Safety Bureau as one of them. Now with the means to face even the toughest of enemies, Denji will stop at nothing to achieve his simple teenage dreams.",11,8.66,Finished
23,Dorohedoro,"Action, Comedy, Fantasy, Horror, Seinen",Hayashida Q,"Hole?a dark, decrepit, and disorderly district where the strong prey on the weak and death is an ordinary occurrence?is all but befitting of the name given to it. A realm separated from law and ethics, it is a testing ground to the magic users who dominate it. As a race occupying the highest rungs of their society, the magic users think of the denizens of Hole as no more than insects. Murdered, mutilated, and made experiments without a second thought, the powerless Hole dwellers litter the halls of Hole's hospital on a daily basis.

Possessing free access to and from the cesspool, and with little challenge to their authority, the magic users appear indomitable to most?aside for a few. Caiman, more reptile than man, is one such individual. He hunts them on a heedless quest for answers with only a trusted pair of bayonets and his immunity to magic. Cursed by his appearance and tormented by nightmares, magic users are his only clue to restoring his life to normal. With his biggest obstacle being his stomach, his female companion Nikaidou, who runs the restaurant Hungry Bug, is his greatest ally.

Set in a gritty world of hellish design, Dorohedoro manages a healthy blend of comedy and lightheartedness with death and carnage. Taking plenty of twists and turns while following the lives of Hole's residents, it weaves a unique world of unearthly origin and dreary appearance not for the squeamish or easily disturbed.",23,8.65,Finished
24,Banana Fish,"Action, Adventure, Drama, Shoujo","Yoshida, Akimi","Ash Lynx is a beauty, a genius?and a murderer. Since childhood, he had been in the care of Dino ""Papa"" Golzine, the mafia boss who turned him into the ruthless killer he is now. At first, Ash was just a pretty face for Golzine?s pleasure, but now estranged from him, a 17-year-old Ash runs his own gang with an iron fist.

Eiji Okumura is a young Japanese photographer. Traveling to New York as an assistant, Eiji is set to work on a report about kids living in the streets. There, he meets teenage gang leader Ash and is mesmerized by the boy?who in turn is curious about Eiji's different lifestyle.

But this is the dark underground of New York, and recently a series of murders has surfaced in the city, connected only by the words ""Banana Fish."" With personal stakes in this mysterious battle, it is up to Ash, Eiji and their allies to discover what exactly ""Banana Fish"" is, where it came from and how to get rid of it?before the world as they know it descends into chaos.",19,8.64,Finished
25,Sousou no Frieren,"Adventure, Fantasy, Shounen",Yamada Kanehito,"The demon king has been defeated, and the victorious hero party returns home before disbanding. The four?mage Frieren, hero Himmel, priest Heiter, and warrior Eisen?reminisce about their decade-long journey as the moment to bid each other farewell arrives. But the passing of time is different for elves, thus Frieren witnesses her companions slowly pass away one by one.

Before his death, Heiter manages to foist a young human apprentice called Fern onto Frieren. Driven by the elf's passion for collecting a myriad of magic spells, the pair embarks on a seemingly aimless journey, revisiting the places that the heroes of yore had visited. Along their travels, Frieren slowly confronts her regrets of missed opportunities to form deeper bonds with her now-deceased comrades.",5,8.63,Publishing
26,Aria,"Adventure, Comedy, Drama, Sci-Fi, Shounen, Slice of Life",Amano Kozue ,"In the distant future, humanity has terraformed Mars into an oceanic planet to suit their needs. Now known as Aqua, the planet serves as a new home for people discontent with living on Manhome?the planet formerly known as Earth. Being a perfect imitation of Manhome's Venice, the town of Neo-Venezia has inherited all of the rustic charms of the original. Gondolas weave their way through the waterways of the dreamy town while nostalgic alleys await those who travel on foot.

Akari Mizunashi, a young Manhome native, has recently made Neo-Venezia her new home. To pursue her dream of becoming a gondolier tour guide?or Undine?Akari joins the Aria Company, one of the most renowned water guide companies in town. As she basks in a simple lifestyle unavailable on Manhome, Akari cheerily ambles through her daily life in Neo-Venezia: the town where magic and miracles abound.
",12,8.63,Finished
